{
  "$schema": "https://json-schema.org/draft/2020-12/schema",
  "type": "object", "additionalProperties": false,
  "required": ["schema", "type", "algorithm", "key_id", "public_key_sha256", "issued_at", "expires_at", "run_id", "plan_sha256", "candidate", "origins", "database", "scope_cleanup", "fixture_manifest_sha256", "action_registry_sha256", "authorizer", "signature"],
  "properties": {
    "schema": {"const": "sand-iam.consumer-acceptance-v2-receipt/v1"},
    "type": {"enum": ["authorization_gate", "fixture_ownership_gate", "cleanup_gate"]},
    "algorithm": {"const": "Ed25519"}, "key_id": {"$ref": "#/$defs/id"}, "public_key_sha256": {"$ref": "#/$defs/sha256"},
    "issued_at": {"type": "string", "format": "date-time", "pattern": "^\\d{4}-\\d{2}-\\d{2}T\\d{2}:\\d{2}:\\d{2}Z$"}, "expires_at": {"type": "string", "format": "date-time", "pattern": "^\\d{4}-\\d{2}-\\d{2}T\\d{2}:\\d{2}:\\d{2}Z$"},
    "run_id": {"$ref": "#/$defs/id"}, "plan_sha256": {"$ref": "#/$defs/sha256"},
    "candidate": {"$ref": "#/$defs/candidate"}, "origins": {"$ref": "#/$defs/origins"}, "database": {"$ref": "#/$defs/database"},
    "scope_cleanup": {"$ref": "#/$defs/scope_cleanup"}, "fixture_manifest_sha256": {"$ref": "#/$defs/sha256"},
    "action_registry_sha256": {"$ref": "#/$defs/sha256"}, "authorizer": {"$ref": "#/$defs/id"},
    "signature": {"type": "string", "contentEncoding": "base64", "pattern": "^[A-Za-z0-9+/]{86}==$"}
  },
  "$defs": {
    "sha256": {"type": "string", "pattern": "^[0-9a-f]{64}$"}, "id": {"type": "string", "pattern": "^[a-z][a-z0-9_-]{2,95}$"},
    "origin": {"type": "string", "pattern": "^https://[a-z0-9.-]+$"},
    "candidate": {"type": "object", "additionalProperties": false, "required": ["candidate_sha256", "host_sha256", "clean_host_revision_sha256", "tree_a_sha256", "tree_b_sha256"], "properties": {"candidate_sha256": {"$ref": "#/$defs/sha256"}, "host_sha256": {"$ref": "#/$defs/sha256"}, "clean_host_revision_sha256": {"$ref": "#/$defs/sha256"}, "tree_a_sha256": {"$ref": "#/$defs/sha256"}, "tree_b_sha256": {"$ref": "#/$defs/sha256"}}},
    "origins": {"type": "object", "additionalProperties": false, "required": ["iam", "a", "b"], "properties": {"iam": {"$ref": "#/$defs/origin"}, "a": {"$ref": "#/$defs/origin"}, "b": {"$ref": "#/$defs/origin"}}},
    "database_binding": {"type": "object", "additionalProperties": false, "required": ["role", "schema_fingerprint_sha256"], "properties": {"role": {"$ref": "#/$defs/id"}, "schema_fingerprint_sha256": {"$ref": "#/$defs/sha256"}}},
    "database": {"type": "object", "additionalProperties": false, "required": ["iam", "a", "b"], "properties": {"iam": {"$ref": "#/$defs/database_binding"}, "a": {"$ref": "#/$defs/database_binding"}, "b": {"$ref": "#/$defs/database_binding"}}},
    "scope_cleanup": {"type": "object", "additionalProperties": false, "required": ["scope_sha256", "cleanup_sha256"], "properties": {"scope_sha256": {"$ref": "#/$defs/sha256"}, "cleanup_sha256": {"$ref": "#/$defs/sha256"}}}
  }
}
