{"schema":"sand-iam.consumer-acceptance-v2-receipt/v1","type":"authorization_gate","algorithm":"Ed25519","key_id":"untrusted_fixture_key","public_key_sha256":"eeeeeeeeeeeeeeeeeeeeeeeeeeeeeeeeeeeeeeeeeeeeeeeeeeeeeeeeeeeeeeee","issued_at":"2026-09-13T09:00:00Z","expires_at":"2026-09-13T11:00:00Z","run_id":"consumer_l04_v2_template","plan_sha256":"cccccccccccccccccccccccccccccccccccccccccccccccccccccccccccccccc","candidate":{"candidate_sha256":"1111111111111111111111111111111111111111111111111111111111111111","host_sha256":"2222222222222222222222222222222222222222222222222222222222222222","clean_host_revision_sha256":"3333333333333333333333333333333333333333333333333333333333333333","tree_a_sha256":"4444444444444444444444444444444444444444444444444444444444444444","tree_b_sha256":"5555555555555555555555555555555555555555555555555555555555555555"},"origins":{"iam":"https://iam.example.test","a":"https://a.example.test","b":"https://b.example.test"},"database":{"iam":{"role":"iam_role","schema_fingerprint_sha256":"6666666666666666666666666666666666666666666666666666666666666666"},"a":{"role":"a_role","schema_fingerprint_sha256":"7777777777777777777777777777777777777777777777777777777777777777"},"b":{"role":"b_role","schema_fingerprint_sha256":"8888888888888888888888888888888888888888888888888888888888888888"}},"scope_cleanup":{"scope_sha256":"9999999999999999999999999999999999999999999999999999999999999999","cleanup_sha256":"aaaaaaaaaaaaaaaaaaaaaaaaaaaaaaaaaaaaaaaaaaaaaaaaaaaaaaaaaaaaaaaa"},"fixture_manifest_sha256":"bbbbbbbbbbbbbbbbbbbbbbbbbbbbbbbbbbbbbbbbbbbbbbbbbbbbbbbbbbbbbbbb","action_registry_sha256":"dddddddddddddddddddddddddddddddddddddddddddddddddddddddddddddddd","authorizer":"untrusted_fixture_authorizer","signature":"AAAAAAAAAAAAAAAAAAAAAAAAAAAAAAAAAAAAAAAAAAAAAAAAAAAAAAAAAAAAAAAAAAAAAAAAAAAAAAAAAAAAAA=="}
